{
  "id": "wf_design-indaba-2025-briefing-001",
  "workflow_name": "Design Indaba 2025 Review Loop",
  "goal": "Capture reusable insights from Briefing.",
  "steps": [
    "Narrative clarity",
    "Constraint as a design tool",
    "Process visibility",
    "Show the reasoning, not only the result",
    "Structure improves creative confidence",
    "Which practices generalise across disciplines?",
    "Which techniques depend on presenter context?"
  ],
  "preconditions": [
    "Source has been ingested and normalized."
  ],
  "decision_points": [
    "Decide which ideas are reusable beyond the event context."
  ],
  "risks": [
    "Capturing interpretation without enough provenance."
  ],
  "best_use_cases": [
    "Event debriefs",
    "Post-session synthesis"
  ],
  "source_refs": [
    "seg_briefing-001",
    "seg_briefing-002",
    "seg_briefing-003"
  ]
}
